{
  "$schema": "http://json-schema.org/draft-07/schema#",
  "type": "object",
  "properties": {
    "name": {
      "type": "string",
      "description": "Name of the Dapp"
    },
    "description": {
      "type": "string",
      "description": "Description of the Dapp"
    },
    "dappImages": {
      "type": "object",
      "properties": {
        "dappBanner": {
          "type": "string",
          "description": "Filename of the Dapp banner image located in the same folder"
        },
        "dappLogo": {
          "type": "string",
          "description": "Filename of the Dapp logo image located in the same folder"
        }
      },
      "required": ["dappBanner", "dappLogo"],
      "description": "Filenames of the Dapp banner and logo images located in the same folder as the JSON file"
    },
    "websiteUrl": {
      "type": "object",
      "properties": {
        "mainnet": {
          "type": "string",
          "format": "uri",
          "description": "URL of the Dapp on the mainnet"
        },
        "testnet": {
          "type": "string",
          "format": "uri",
          "description": "URL of the Dapp on the testnet"
        }
      },
      "required": ["mainnet", "testnet"],
      "description": "Website URLs for the Dapp on mainnet and testnet"
    },
    "category": {
      "type": "array",
      "items": {
        "type": "string",
        "enum": [
          "DeFi-Lending & Borrowing",
          "DeFi-Decentralized Exchanges (DEX)",
          "DeFi-Yield Farming",
          "DeFi-Liquid Staking",
          "DeFi-Insurance",
          "NFT-Collectibles",
          "NFT-Virtual Real Estate",
          "NFT-Domain Names",
          "NFT-Music",
          "NFT-Sports & Gaming",
          "Social-Decentralized Social Networks",
          "Social-Content Creation & Monetization",
          "Social-Messaging & Communication",
          "Social-Decentralized Autonomous Organizations (DAO)",
          "Infrastructure-Oracle Providers",
          "Infrastructure-Interoperability & Cross-Chain",
          "Infrastructure-Data Storage",
          "Infrastructure-Identity & Authentication",
          "Privacy-Privacy-preserving Technologies",
          "Privacy-Private Transactions",
          "Tools & Utilities-Wallets",
          "Tools & Utilities-Analytics & Tracking",
          "Tools & Utilities-Developer Tools",
          "Tools & Utilities-Governance",
          "Unknown"
        ]
      },
      "description": "Categories of the Dapp"
    },
    "privacyPolicyUrl": {
      "type": "string",
      "format": "uri",
      "description": "URL of the Privacy Policy"
    },
    "termsOfServiceUrl": {
      "type": "string",
      "format": "uri",
      "description": "URL of the Terms of Service"
    },
    "githubUrl": {
      "type": "string",
      "format": "uri",
      "description": "URL of the Dapp's GitHub repository"
    },
    "contactEmail": {
      "type": "string",
      "format": "email",
      "description": "Contact email for the Dapp"
    },
    "smartContractAddresses": {
      "type": "object",
      "properties": {
        "mainnet": {
          "type": "array",
          "items": {
            "type": "string"
          }
        },
        "testnet": {
          "type": "array",
          "items": {
            "type": "string"
          }
        }
      },
      "description": "Smart contract addresses for the Dapp on mainnet and testnet"
    },
    "enabled": {
      "type": "boolean",
      "description": "Flag to indicate whether the Dapp should be enabled or disabled in the wallet Dapp browser."
    }
  },
  "required": ["name", "description", "dappImages", "websiteUrl", "category", "enabled"],
  "description": "Schema for Dapp details"
}
