{
  "name": "Astrovault",
  "description": "DeFi, Sustainably.",
  "dappImages": {
    "dappBanner": "axv-banner.png",
    "dappLogo": "axv-logo.png"
  },
  "websiteUrl": {
    "mainnet": "https://app.astrovault.io",
    "testnet": "https://wip.astrovault.io"
  },
  "category": [
    "DeFi-Decentralized Exchanges (DEX)",
    "DeFi-Yield Farming",
    "DeFi-Liquid Staking",
    "Infrastructure-Interoperability & Cross-Chain"
  ],
  "enabled": false
}
